[
  {
    "research_id": "round2_south_001",
    "name": "Padmasambhava Mahavihara Monastery",
    "aliases": [
      "Jirang Monastery",
      "Thupten Mindolling Monastery",
      "Chandragiri Tibetan Monastery"
    ],
    "district": "Gajapati",
    "region": "southern",
    "category": "heritage",
    "description": "Padmasambhava Mahavihara is a large Tibetan Buddhist monastery in Chandragiri, Gajapati district, inaugurated by the 14th Dalai Lama in 2010. It is widely regarded as the largest Tibetan Buddhist monastery in eastern India. The five-storey complex is built in traditional Himalayan architectural style and serves as a monastery-college for monks from the Tibetan refugee settlement of Phuntsokling, established after the 1959 Chinese invasion of Tibet.",
    "lat": 19.2716,
    "lon": 84.2638,
    "coordinate_source": "OpenStreetMap Nominatim (verified: Padmasambhava Mahavihara, Gajapati, Odisha)",
    "coordinate_verification_status": "cross_checked",
    "primary_source_url": "https://odishatourism.gov.in/content/tourism/en/discover/attractions/pilgrimages/padmasambhava-mahavihara.html",
    "secondary_source_urls": [
      "https://en.wikipedia.org/wiki/Padmasambhava_Mahavihara_monastery"
    ],
    "image_source_url": "https://upload.wikimedia.org/wikipedia/commons/a/a4/Chandragiri_Lobersing_Ganjam_Odisha1.jpg",
    "image_source_domain": "commons.wikimedia.org",
    "image_license_note": "CC BY-SA 3.0",
    "image_status": "pending",
    "researcher": "Susmita",
    "verification_status": "staging",
    "notes": "Coordinates confirmed via Wikipedia infobox (19.2733N, 84.2633E) and OSM Nominatim (19.2716, 84.2638). Wikimedia image confirmed: Chandragiri_Lobersing_Ganjam_Odisha1.jpg (2048x1152, CC BY-SA 3.0 by Anant Panda, Category:Padmasambhava Mahavihara). The Tibetan settlement at Chandragiri is a notable community of Tibetan refugees; description uses respectful, factual language about their history."
  },
  {
    "research_id": "round2_south_002",
    "name": "Tampara Lake",
    "aliases": [
      "Tampara Lagoon",
      "Tampara Eco Tourism Centre",
      "Tampara Beach Lake"
    ],
    "district": "Ganjam",
    "region": "southern",
    "category": "lake",
    "description": "Tampara is a shallow coastal saltwater lake and eco-tourism destination near Chhatrapur in Ganjam district, separated from the Bay of Bengal by a narrow sand bar. Spread over approximately 320 hectares, the lake is a significant wetland habitat for migratory waterfowl and resident species. OTDC operates a tourist cottage and boating facility at the lake.",
    "lat": 19.3478,
    "lon": 84.9975,
    "coordinate_source": "OpenStreetMap Nominatim verified: Tampara Lake, Chhatrapur, Ganjam, Odisha",
    "coordinate_verification_status": "verified",
    "primary_source_url": "https://odishatourism.gov.in/content/tourism/en/discover/attractions/beaches/tampara-beach.html",
    "secondary_source_urls": [
      "https://ganjam.nic.in/tourist-place/tampara/",
      "https://en.wikipedia.org/wiki/Tampara_Lake"
    ],
    "image_source_url": "https://upload.wikimedia.org/wikipedia/commons/6/6c/Tampara_lake.jpg",
    "image_source_domain": "commons.wikimedia.org",
    "image_license_note": "CC BY-SA 4.0",
    "image_status": "pending",
    "researcher": "Susmita",
    "verification_status": "staging",
    "notes": "Coordinates verified via OSM Nominatim (19.347752, 84.9975178). Two Wikimedia images confirmed: Tampara_lake,_chatrapur.jpg (1900x1069) and Tampara_lake.jpg (2112x1188), both CC BY-SA 4.0. Coastal lagoon, not same location as Gopalpur-on-Sea — no production duplicate."
  },
  {
    "research_id": "round2_south_003",
    "name": "Potagarh Fort",
    "aliases": [
      "Ganjam Fort",
      "Potagarh Ruins",
      "Potagarh Dutch-British Fort"
    ],
    "district": "Ganjam",
    "region": "southern",
    "category": "heritage",
    "description": "Potagarh Fort is a ruined 17th-century coastal fort near Ganjam town, originally built by the Dutch and later occupied by the British East India Company. The fort stands near the mouth of the Rushikulya river and is associated with the early European trading history of the Odisha coast. It is listed as a heritage site by the Odisha State Archaeology Department.",
    "lat": 19.3822,
    "lon": 85.0563,
    "coordinate_source": "OpenStreetMap Nominatim verified: Potagarh road, Ganjam, Odisha",
    "coordinate_verification_status": "cross_checked",
    "primary_source_url": "https://ganjam.nic.in/tourist-place/potagarh/",
    "secondary_source_urls": [
      "https://en.wikipedia.org/wiki/Potagarh"
    ],
    "image_source_url": "https://upload.wikimedia.org/wikipedia/commons/5/59/Ganjam_Fort.jpg",
    "image_source_domain": "commons.wikimedia.org",
    "image_license_note": "CC BY-SA 4.0",
    "image_status": "pending",
    "researcher": "Susmita",
    "verification_status": "staging",
    "notes": "OSM confirmed (19.3822, 85.0563). Wikimedia image Ganjam_Fort.jpg (5312x2988, CC BY-SA 4.0) confirmed. Distinct from existing Ganjam production catalog entries (Gopalpur, Tara Tarini, MKCG). Ganjam_Fort.jpg on Commons specifically labelled as this fort."
  },
  {
    "research_id": "round2_south_004",
    "name": "Aryapalli Beach",
    "aliases": [
      "Aryapalla Beach",
      "Aryapal Beach",
      "Chhatrapur Aryapalli"
    ],
    "district": "Ganjam",
    "region": "southern",
    "category": "beach",
    "description": "Aryapalli Beach is a pristine, largely undeveloped shoreline near Chhatrapur in Ganjam district. Located adjacent to the Tampara Lake eco-zone, the beach is known for nesting of Olive Ridley sea turtles during the winter season and is included in the Rushikulya sea turtle conservation stretch. The Odisha Forest Department monitors turtle nesting activity at this beach.",
    "lat": 19.363,
    "lon": 84.993,
    "coordinate_source": "Approximate from OSM location of New Aryapalli, Chhatrapur, Ganjam; pending precise verification",
    "coordinate_verification_status": "pending",
    "primary_source_url": "https://ganjam.nic.in/tourist-place/",
    "secondary_source_urls": [
      "https://odishatourism.gov.in/"
    ],
    "image_source_url": "",
    "image_source_domain": "",
    "image_license_note": "",
    "image_status": "missing",
    "researcher": "Susmita",
    "verification_status": "research",
    "notes": "Coordinates are approximate based on OSM Nominatim result for New Aryapalli. OSM did not return a direct result for Aryapalli Beach itself. Coordinate status set to pending. No verified Wikimedia Commons image found for this specific beach — image_status is missing. Candidate retained for research value; needs image verification before production promotion."
  },
  {
    "research_id": "round2_south_005",
    "name": "Brundaban Palace, Paralakhemundi",
    "aliases": [
      "Paralakhemundi Palace",
      "Gajapati Raja Palace",
      "Maharaja of Parlakimidi Palace"
    ],
    "district": "Gajapati",
    "region": "southern",
    "category": "heritage",
    "description": "Brundaban Palace is the ancestral seat of the Maharaja of Parlakhemundi (Gajapati rulers), located in Paralakhemundi town, Gajapati district. The palace complex, built in the 19th century, reflects the princely architectural tradition of coastal Odisha. The town of Paralakhemundi, associated with nationalist leader Gopabandhu Das, is the administrative headquarters of Gajapati district.",
    "lat": 18.7786,
    "lon": 84.0869,
    "coordinate_source": "OpenStreetMap Nominatim verified: Gajapati Palace, liveling road, Paralakhemundi Town, Gajapati, Odisha",
    "coordinate_verification_status": "verified",
    "primary_source_url": "https://gajapati.nic.in/tourist-place/",
    "secondary_source_urls": [
      "https://en.wikipedia.org/wiki/Paralakhemundi"
    ],
    "image_source_url": "https://upload.wikimedia.org/wikipedia/commons/1/1c/Gajapati_Palace_2025.png",
    "image_source_domain": "commons.wikimedia.org",
    "image_license_note": "CC0",
    "image_status": "pending",
    "researcher": "Susmita",
    "verification_status": "staging",
    "notes": "Coordinates verified via OSM Nominatim (18.7786141, 84.0869042). Authentic Wikimedia Commons photograph confirmed: File:Gajapati_Palace_2025.png by Santosh Kumar Panda under CC0 public domain dedication. Promoted to staging; zero duplicate collision in places.json."
  },
  {
    "research_id": "round2_south_006",
    "name": "Purunakatak Maa Bhairabi Temple",
    "aliases": [
      "Maa Bhairabi Temple Purunakatak",
      "Purunakatak Bhairabi Pitha",
      "Boudh Bhairabi Shrine"
    ],
    "district": "Boudh",
    "region": "southern",
    "category": "temple",
    "description": "Purunakatak Maa Bhairabi Temple is an ancient Shakti pitha located at Purunakatak in Boudh district, on the banks of the Mahanadi River. The presiding deity is Goddess Bhairabi, worshipped as a powerful form of the divine feminine. The temple is a significant pilgrimage site for communities across Boudh district and surrounding areas.",
    "lat": 20.5222,
    "lon": 84.3028,
    "coordinate_source": "OSM Nominatim approximate from Purunakatak, Boudh, Odisha; cross-checked with Wikipedia coordinates for Purunakatak town",
    "coordinate_verification_status": "pending",
    "primary_source_url": "https://boudh.nic.in/tourist-place/",
    "secondary_source_urls": [
      "https://en.wikipedia.org/wiki/Boudh_district"
    ],
    "image_source_url": "https://upload.wikimedia.org/wikipedia/commons/4/4e/Maa_Bhairabi_Temple_Purunakatak.JPG",
    "image_source_domain": "commons.wikimedia.org",
    "image_license_note": "CC BY-SA 4.0",
    "image_status": "pending",
    "researcher": "Susmita",
    "verification_status": "staging",